{
  "authority_contract": "docs/universal-closed-loop-outcome-reconciliation.md",
  "baseline": {
    "created_at": "1970-01-01T00:00:00Z",
    "source_commit": "af8c4560f8a8087e7116854a0291e443b1d7d874",
    "source_digest": "3ed5d1b921ee71fd19d7b84300b23f6bf6b32209b6608dc56b56b3de9e187b95",
    "updated_at": "2026-08-28T21:30:51Z"
  },
  "bindings": [
    {
      "path": "work/ideas/idea-universal-closed-loop-outcome-reconciliation.md",
      "role": "idea",
      "sha256": "961786b737bdb679e449584f056033492f4cc351a120a34fe904c0735659bdae"
    },
    {
      "path": "work/maps/map-universal-closed-loop-outcome-reconciliation.md",
      "role": "project-map",
      "sha256": "aa14a1fc80c2376006d536f9a52812db23f8bfa41c331495fefc7c11d97a42b2"
    },
    {
      "path": "work/roadmaps/roadmap-universal-closed-loop-outcome-reconciliation.md",
      "role": "program-roadmap",
      "sha256": "5709e69cb3e29c3b984daaa9ee2a265ac496a4ef5412e2240bbdbf6618aada94"
    },
    {
      "path": "docs/universal-closed-loop-outcome-reconciliation.md",
      "role": "authority-contract",
      "sha256": "bf92f40ad840676dfff2c89b677fb265b2e60e9f30a5b7efd994d6e0f35e150f"
    },
    {
      "path": "scripts/bootstrap_closure.py",
      "role": "bootstrap-tool",
      "sha256": "4bca8c8ede481e48bdac3f8e24a05c19d7801d03426f208c7aebd2339f6d9c42"
    },
    {
      "path": "scripts/outcome_reconciliation.py",
      "role": "existing-vertical-slice",
      "sha256": "27dc703c80f773a1da8a52a55ea458ab48cb7fdfe9a83309bca27671450b5496"
    }
  ],
  "changes": [
    {
      "authorization": "Owner-approved Universal Closed-Loop Program Roadmap; Campaign 110",
      "decision_ids": [
        "DEC-CLOSED-002",
        "DEC-CLOSED-003",
        "DEC-CLOSED-004",
        "DEC-CLOSED-005"
      ],
      "evidence_to_rerun": [
        "EVID-CLOSED-G2-ENGINE"
      ],
      "id": "CHG-CLOSED-001",
      "rationale": "Campaign 110 requires one entry-point-neutral guarded engine before lifecycle surfaces can consume closure state.",
      "recorded_at": "2026-08-28T20:48:02Z",
      "requirement_ids": [
        "REQ-CLOSED-004",
        "REQ-CLOSED-005",
        "REQ-CLOSED-006"
      ],
      "source_commit": "af8c4560f8a8087e7116854a0291e443b1d7d874",
      "summary": "Implement the schema-v1 generic reconciliation manifest engine and preserve HPT2 compatibility",
      "supersedes": []
    },
    {
      "authorization": "Owner-approved Universal Closed-Loop Program Roadmap; Campaign 111",
      "decision_ids": [
        "DEC-CLOSED-001",
        "DEC-CLOSED-002",
        "DEC-CLOSED-004",
        "DEC-CLOSED-006",
        "DEC-CLOSED-007"
      ],
      "evidence_to_rerun": [
        "EVID-CLOSED-G3-INTEGRATION"
      ],
      "id": "CHG-CLOSED-002",
      "rationale": "G3 requires terminal activity to remain distinct from reconciled outcomes and for the nearest open owning loop to remain visible without moving file lifecycle authority.",
      "recorded_at": "2026-08-28T21:10:17Z",
      "requirement_ids": [
        "REQ-CLOSED-007",
        "REQ-CLOSED-008",
        "REQ-CLOSED-009"
      ],
      "source_commit": "af8c4560f8a8087e7116854a0291e443b1d7d874",
      "summary": "Integrate independent outcome state, result propagation, direct capsules, and guarded root transitions across Tool Shed lifecycle and orientation surfaces",
      "supersedes": []
    },
    {
      "authorization": "Owner-authorized end-to-end Universal Closed-Loop PRM G4 qualification on 2026-08-28",
      "decision_ids": [
        "DEC-CLOSED-003",
        "DEC-CLOSED-005",
        "DEC-CLOSED-007"
      ],
      "evidence_to_rerun": [
        "EVID-CLOSED-G4-RECOVERY"
      ],
      "id": "CHG-CLOSED-003",
      "rationale": "G4 qualification found that direct-SQL detection alone left no governed route to retain a deliberately reviewed mutation. The substrate and rehearsal now bind acceptance to the exact review state, revision, digest, project, authorization, and checkpoint, while recovery tests prove backup, rebuild, interruption rollback, ambiguity refusal, and historical queries.",
      "recorded_at": "2026-08-28T21:22:07Z",
      "requirement_ids": [
        "REQ-CLOSED-010",
        "REQ-CLOSED-011"
      ],
      "source_commit": "af8c4560f8a8087e7116854a0291e443b1d7d874",
      "summary": "Prove exact direct-SQL acceptance and deterministic recovery",
      "supersedes": []
    }
  ],
  "decisions": [
    {
      "id": "DEC-CLOSED-001",
      "rationale": "Activity completion and outcome realization answer different questions and must remain independently reportable.",
      "status": "settled",
      "summary": "Keep lifecycle, outcome verdict, and reconciliation as independent dimensions"
    },
    {
      "id": "DEC-CLOSED-002",
      "rationale": "A central vocabulary and graph prevent entry-point-specific tools from drifting into incompatible meanings of completion.",
      "status": "settled",
      "summary": "Use one entry-point-neutral reconciliation engine"
    },
    {
      "id": "DEC-CLOSED-003",
      "rationale": "The released hybrid substrate already provides the minimum structured tables, recovery ledger, and checkpoint needed by the universal slice.",
      "status": "settled",
      "summary": "Use schema-version-1 hybrid state before proposing schema expansion"
    },
    {
      "id": "DEC-CLOSED-004",
      "rationale": "Owner-authored narrative benefits from Git review and flexible Markdown, while mutable relational closure state benefits from guarded SQLite transactions.",
      "status": "settled",
      "summary": "Preserve the current file and SQLite authority split without dual writes"
    },
    {
      "id": "DEC-CLOSED-005",
      "rationale": "Later knowledge must not make historical records appear more complete than they were at the time.",
      "status": "settled",
      "summary": "Backfill through dated overlays and preserve historical ambiguity"
    },
    {
      "id": "DEC-CLOSED-006",
      "rationale": "Minimum sufficient coordination requires direct work to remain light while still allowing durable product changes to close explicitly.",
      "status": "settled",
      "summary": "Allow compact direct-work closure capsules instead of mandatory artifacts"
    },
    {
      "id": "DEC-CLOSED-007",
      "rationale": "A feature cannot safely be the sole authority that declares its own correctness during implementation.",
      "status": "settled",
      "summary": "Keep an independent file and Git bootstrap closure through final release proof"
    },
    {
      "id": "DEC-CLOSED-008",
      "rationale": "The released-client canary consumes publication, so publication must be gated by G1 through G4 while G5 and the initiative remain open until the canary reconciles.",
      "status": "settled",
      "summary": "Stage publication before the final disconnected-client gate"
    }
  ],
  "evidence": [
    {
      "covers_change_ids": [],
      "gate": "G1-CONTRACT-BOOTSTRAP-FROZEN",
      "id": "EVID-CLOSED-G1-CONTRACT",
      "references": [
        {
          "path": "work/evidence/evidence-universal-closed-loop-g1-contract.md",
          "sha256": "97c3270b82e86c9f8c95e6f692dfab56cae20e71cb96984e8d23f367a906c883"
        },
        {
          "path": "docs/universal-closed-loop-outcome-reconciliation.md",
          "sha256": "bf92f40ad840676dfff2c89b677fb265b2e60e9f30a5b7efd994d6e0f35e150f"
        },
        {
          "path": "work/maps/map-universal-closed-loop-outcome-reconciliation.md",
          "sha256": "aa14a1fc80c2376006d536f9a52812db23f8bfa41c331495fefc7c11d97a42b2"
        },
        {
          "path": "work/roadmaps/roadmap-universal-closed-loop-outcome-reconciliation.md",
          "sha256": "5709e69cb3e29c3b984daaa9ee2a265ac496a4ef5412e2240bbdbf6618aada94"
        },
        {
          "path": "scripts/bootstrap_closure.py",
          "sha256": "4bca8c8ede481e48bdac3f8e24a05c19d7801d03426f208c7aebd2339f6d9c42"
        },
        {
          "path": "tests/test_bootstrap_closure.py",
          "sha256": "53e6776043ce85e87ec96e087ecce9c2e80e95cc1f429d8599fa5ee4641edac7"
        }
      ],
      "status": "passed",
      "verified_at": "2026-08-28T21:12:57Z"
    },
    {
      "covers_change_ids": [
        "CHG-CLOSED-001"
      ],
      "gate": "G2-GENERIC-ENGINE-PROVEN",
      "id": "EVID-CLOSED-G2-ENGINE",
      "references": [
        {
          "path": "work/evidence/evidence-universal-closed-loop-g2-engine.md",
          "sha256": "c9d9856323274cc442e2fb3aa71f14e1ca425ed67c97bb5c774532fb4e33a818"
        },
        {
          "path": "scripts/outcome_loop.py",
          "sha256": "370a41b101463a751e586bfb72e7ccfe70bff413c4ea6b28a252fa3494cf1f5f"
        },
        {
          "path": "scripts/outcome_reconciliation.py",
          "sha256": "27dc703c80f773a1da8a52a55ea458ab48cb7fdfe9a83309bca27671450b5496"
        },
        {
          "path": "schemas/outcome-reconciliation/v1/source.schema.json",
          "sha256": "025515720e206c9c957232fee9e7b22c649d60bf782eada4c6b979d5c0c13de2"
        },
        {
          "path": "schemas/outcome-reconciliation/v1/manifest.schema.json",
          "sha256": "481a7eff9ad46e1ad230da9c6d51d13594b01ad7855bcce1b3a9afba15e69cb7"
        },
        {
          "path": "schemas/outcome-reconciliation/v1/transition.schema.json",
          "sha256": "1764a578b13f2d89e561258c1445c07e16af00eb7008bf422151945b27170d6c"
        },
        {
          "path": "tests/test_outcome_reconciliation.py",
          "sha256": "7f0ad83c8742582484b9780384f9c2f4394f6c9e03855bea81d888cc8c1bbdd6"
        },
        {
          "path": "docs/universal-closed-loop-outcome-reconciliation.md",
          "sha256": "bf92f40ad840676dfff2c89b677fb265b2e60e9f30a5b7efd994d6e0f35e150f"
        },
        {
          "path": "docs/commands.md",
          "sha256": "f8805e11458a6912311222759f5243483b5583a236663713ffebcd9e77d9dcb3"
        },
        {